{"$schema":"https://json-schema.org/draft/2020-12/schema","$id":"https://buildinpublicuniversity.com/humain-api/schemas/voice-session.v1.json","title":"HumAIn Voice Session v1","type":"object","additionalProperties":false,"required":["schema","session_id","pointer","allowed_actions","capability_expires_at","disclosure_text"],"properties":{"schema":{"const":"humain.voice.session.v1"},"session_id":{"type":"string","minLength":1},"pointer":{"type":"string","format":"uri"},"allowed_actions":{"type":"array","items":{"type":"string"}},"capability_expires_at":{"type":"string","format":"date-time"},"disclosure_text":{"type":"string","minLength":1},"conversation_id":{"type":["string","null"]}}}