{"schema":"humain.voice.session.v1","session_id":"call-session:demo-001","pointer":"https://story.markets/","allowed_actions":["resolve"],"capability_expires_at":"2030-01-01T00:00:00Z","disclosure_text":"I am an AI voice agent calling with permission. I can discuss the trusted context available for this public pointer, but I cannot claim that a payment or commitment occurred.","conversation_id":null}